<?xml version="1.0" encoding="UTF-8"?><xs:schema xmlns:xs="http://www.w3.org/2001/XMLSchema"
targetNamespace="https://www.w3schools.com"
xmlns="https://www.w3schools.com"
elementFormDefault="qualified"><xsd:element name="table"><xsd:complexType><xsd:sequence><xsd:element name="row" maxOccurs="unbounded"><xsd:complexType><xsd:sequence><xsd:element name="Course" type="xsd:string"></xsd:element><xsd:element name="Grade" type="xsd:string"></xsd:element><xsd:element name="Marks" type="xsd:string"></xsd:element> </xsd:sequence></xsd:complexType></xsd:element></xsd:sequence></xsd:complexType></xsd:element></xsd:schema>