<?xml version="1.0" encoding="UTF-8"?><table xmlns:xsi="http://www.w3.org/2000/10/XMLSchema-instance" xsi:schemaLocation="http://www.w3schools.com file:///C:/Users/HP-/Documents/NetBeansProjects/Database/src/eg/edu/alexu/csd/oop/db/test.xsd"><row><Course>varchar</Course><Grade>varchar</Grade><Marks>int</Marks></row><row><Course>Programming_II</Course><Grade>A</Grade><Marks>0</Marks></row><row><Course>Programming_II</Course><Grade>A</Grade><Marks>0</Marks></row><row><Course>Programming_II</Course><Grade>A</Grade><Marks>0</Marks></row><row><Course>Programming_II</Course><Grade>A</Grade><Marks>0</Marks></row><row><Course>Programming_II</Course><Grade>A</Grade><Marks>0</Marks></row><row><Course>Programming_II</Course><Grade>A</Grade><Marks>0</Marks></row></table>